Country;AccountCtry;Account;DateOf1stVisit;Week;Corp;Segment;Size;Debtors;ERP;1st Visits;Sector;SalesRep;Channel;LeadCost;VisitsCost;NumberOfVisits;ConsultancyFee;AnnualSubscriptionFee;1stYearAmount;Reason;T1;T2;T3;T4;description;CurrentPhase;OriginStage;FiscalId;Campaign;ExtendedReason;OppStatus;DateOfClose;DateOfProposal;Probability;#Days;Validation;FirtsName;SuperChannel;PreSales;Contact;Job;DateOfCreation;DateOfTargetMarket;DateOf1stContact;DateOfLead;DateOfBeginOfStudy;DateOfEndOfStudy;DateOfContract;InitialSalesRep;DateOf1stProposal;Study;Insurance;'Sales'[InsuranceCompany];EmailSalesRep;SizeRank;DebtorsRank;DateOfPostponed;Province;QuoteStatus;DateOfStudy;DateOfQuote;DateOfCancel;DateOfRejected;DateOfAcceptance;LeadStatus;NationalDebtors;TotalLeads;NationalLeads;InernationalDebtors;InternacionalLeads;Customers;DateOfScheduledStudy;IdOpportunity;OppOwner;ModifiedBy;DateOfModification;DateOfScheduled1stVisit;DateOfScheduledProposal;Category;CancelReason;DateOfLastProposal;CampaignStatus;IdAccount;OppDays;Competitor;TerminatedDate;TerminatedType;TerminatedReason;TerminatedSubReason;TerminatedComment;TerminatedAmount;CampaignLead;DateOfLastAppoinment;LastOpp;FiscalIdIndex;FiscalIdNoFirstLetter;LeadOwner;id_sk_DateOfDelivery;'Sales'[Status];Node;MultiNode;DateOfDelivery;Companies;CreditDebtors;CreditSales;SalesByCustomer;DelinquencyRate;DefaultRate;DaysOfDelay;ContactEmail;Skype1stVisits;Skype1stProposal;OppType;Subreason;Subreason2;ReasonDescr;ACPD;DateOfLeave;CorporationId;Proposal;LockType;StatusAccountCrm;ProjectManager;DiscardDate;CampaignGroupName;IsCancelled;IsCommited;CancelledBeforeImplanted;NumberOfIncidents;LeadCreator;LastAppointmentRecord;LastCreatedRecord;LeadOwnerCountry;LastTerminatedRecord;id_sk_TerminatedDate;EmailLeadOwner;Id_rp_TerminatedDate_Date;IsNextLead;Address_line;Address_OK;contactInformation;Skype1stStudy;FiscalIdLast8;VersionERP;OriginalSalesRep;QualifiedProposal;T234;T5;TotalCall;TotalUtil;TotalDuration;DateOf1stCall;DateOfLastCall;City;PostalCode;Interlocutor;ComiteAprobacion;ResponsableIT;ResponsableLegal;Decisor;ExtraVisit;QuoteNumber;ContractNumber;AXCode;OtroERP;Type;WorkedBy;LastOppNoSCFlex;IsDelivered;ContactPhone;EligibleInvoicesAmt;12mTurnover;HasPolicy;%AnnualToVSAnnualDsAmt;DebEligAnnualSales;CIModule;DateOfCIActivation;Firmante_SO;ResponsableFinanciero_SO;ResponsableIT_SO;InicioProyecto_SO;FechaInicio_SO;FranquiciaMensual_SO;SizeRankCalculated;CurrentOpp;RNGStartDateConsultancy;RNGEndedDateConsultancy;RNGStartDateAnnualSub;RNGEndedDateAnnualSub;Phase1Platform;CompaniesNumber;PlatformsNumber;UmbrellaPlatform;FMChile;FMColombia;FMEspana;FMInternacional;FMMexico;FMPeru;FMPortugal;UPSRNGReason;UPSRNGSubGReason;AgeingOpp;AgeingContract;Contract0Filter;CreatorOf1stVisits;LastPhoneCallOwner;PartnerSource;FirstAppointmentOwner;DebtorsRankCalculated;DateOfLastCallLead;CreditStatus;HasPortfolio;ConsultancyFeeLocal;AnnualSubscriptionFeeLocal;Currency;SizeRankOrder;CurrentSalesRep;IdSCFlex;'SCFlex'[insuranceCompany];creationDate;%anonymous;%sinisterCoverage;%exportation;%insuredFacture;broker;comments;author;transactionCurrency;previousNoticeDays;exchangeType;renovationDate;franchise;franchiseBase;studyCosts;maintenanceCosts;revisionCosts;modifiedOn;Premium;premiumBase;minimunPremium;minimunPremiumBase;'SCFlex'[status];state;WarningDate
ESP;ESP;PRYSMIAN CABLES SPAIN;07/02/2025;6;FALSO;G2;€ 647.651.000;0;SAP;1;Electricidad;Antonio Caro Lázaro;Cold calling;€ 0;€ 80;1;;;€ 0;;3;;;;Lead - 18/09/2024 0:00;Postponed;Lead;A08395162;ESP_TLC_2025_Prio1;7/02 Me reúno con Marta Arza (CM Iberia): Me comenta que la única necesidad que tienen es de SC. Quieren cubrir los riesgo que no cubre Solunion, que;Aplazada;;;;3;Valid;Antonio;Cold Calling;Antonio Caro Lázaro;;Unknow;18/09/2024;18/09/2024;04/02/2025;04/02/2025;;;;ACL;;No;Yes;;8b496e6c798c424e8edf75e292ef96;> 100 MM €;500 - 2000;11/11/2025;BARCELONA;;;;;;;Qualified;0,0;0;0;0;0,0;;;8632772668340050000;Antonio Caro Lázaro;Antonio Caro Lázaro;07/02/2025;;;Prime;"Me reúno con Marta Arza (CM Iberia): Me comenta que la única necesidad que tienen es de SC. Quieren cubrir los riesgo que no cubre Solunion, que por política de su Matriz, es su aseguradora y no podemos eliminarla.
Los paises donde necesitan esta cobertura están fuera de nuestro ámbito. Suelen ser con riesgo país, africa, asia, etc.No pueden hacer nada que no autorice su matriz a nivel de headquarter. La automatización y consolidación lo tienen solucionado y solo quieren SC.
Acordamos retomar cuando tengamos aseguramiento en alguna de estas zonas.";;Active;8632772225958420000;0,0;;;;;;;;;07/02/2025;1;11;8395162;Mario Fernández Frade;-1;Postponed;;;;;;;;;;;;FALSO;;Captación;;;"Me reúno con Marta Arza (CM Iberia): Me comenta que la única necesidad que tienen es de SC. Quieren cubrir los riesgo que no cubre Solunion, que por política de su Matriz, es su aseguradora y no podemos eliminarla.
Los paises donde necesitan esta cobertura están fuera de nuestro ámbito. Suelen ser con riesgo país, africa, asia, etc.No pueden hacer nada que no autorice su matriz a nivel de headquarter. La automatización y consolidación lo tienen solucionado y solo quieren SC.
Acordamos retomar cuando tengamos aseguramiento en alguna de estas zonas.";FALSO;;;FALSO;ND;Active;;;Others;FALSO;FALSO;Other;;Paz Espin Cañabate;VERDADERO;VERDADERO;ESP;FALSO;-1;mffrade@atlax360.com;0;VERDADERO;CARRETERA C 15 KM 2. POLIGONO;VERDADERO;VERDADERO;;8395162;SAP S/4Hana Cloud;;FALSO;;299,0;2,0;0,0;0,0;04/02/2025;04/02/2025;VILANOVA I LA GELTRU;08800;0;0;0;0;0;0;;;;;Gran Cuenta;;1;FALSO;;;;False;;;FALSO;;;;;;;;>=100M €;VERDADERO;;;;;FALSO;1,0;1,0;FALSO;;;;;;;;;;299;;FALSO;Mario Fernández Frade;Mario Fernández Frade;;;< 200;04/02/2025;Not Implemented;FALSO;;;EUR;4;Others;3,42175e+17;SOLUNION;07/02/2025;;;;;;No pueden prescindir de Solunion por temas corporativos;Antonio Caro Lázaro;;;;30/12/2025;;;;;;07/02/2025;;;;;Activo;Activo;30/12/2025
ESP;ESP;SECURITAS SEGURIDAD ESPAÑA S.A;06/03/2025;10;FALSO;G1;€ 350.655.142;12.000;Microsoft;1;Actividades Administrativas, Profesionales y Auxiliares;Antonio Caro Lázaro;Cold calling;€ 0;€ 80;1;;;€ 0;;27;272,0;;;SECURITAS SEGURIDAD ESPAÑA S.A;1stVisit;Lead;A79252219;ESP_TLC_PlanMK;06/03 Me reúno con David, Ainhoram Esrher y Estefanía . David comenta que están migrando a AXAPTA y que ve complicado que autoricen que compartan dato;Solución Presentada;;;10 %;299;Valid;Antonio;Cold Calling;Antonio Caro Lázaro;;Unknow;19/03/2020;19/03/2020;25/03/2020;07/02/2025;;;;ACL;;No;NO;;8b496e6c798c424e8edf75e292ef96;> 100 MM €;> 8000;;MADRID;;;;;;;Qualified;12000,0;0;0;0;0,0;;;-3690669186059990000;Antonio Caro Lázaro;Antonio Caro Lázaro;07/03/2025;;;Prime;;;Active;-1300986306755290000;1780,0; Informa;;;;;;;;06/03/2025;1;11;79252219;Mario Fernández Frade;-1;1stVisit;;;;;;;;;;;;FALSO;;Captación;;;;FALSO;;;FALSO;ND;Active;;;Others;FALSO;FALSO;Other;;Paz Espin Cañabate;VERDADERO;VERDADERO;ESP;FALSO;-1;mffrade@atlax360.com;0;VERDADERO;C/ Entrepeñas 27;VERDADERO;VERDADERO;;79252219;Axapta;;FALSO;272,0;272,0;170,0;10,0;0,0;10/07/2023;07/02/2025;MADRID;28051;0;0;0;0;0;0;;;;;Gran Cuenta;;1;FALSO;;;;False;;;FALSO;;;;;;;;>=100M €;VERDADERO;;;;;FALSO;1,0;1,0;FALSO;;;;;;;;;;272;;FALSO;Mario Fernández Frade;Mario Fernández Frade;;;> 8000;07/02/2025;Not Implemented;FALSO;;;EUR;4;Others;-2,91154e+17;NO ASEGURADORA;07/03/2025;;;;;;;Antonio Caro Lázaro;;;;;;;;;;07/03/2025;;;;;Activo;Activo;
ESP;ESP;COMSA;22/01/2025;4;FALSO;G1;€ 263.074.000;0;SAP;1;Construcción;Antonio Caro Lázaro;Asociaciones;€ 0;€ 80;1;;;€ 0;;15;;;;COMSA - 22/06/2022 0:00;Cancelled;Lead;A08031098;ESP_ForoTesoreriaASSET_may24;22/01/25 Me reúno con Miguel López (resp. de caja y clientes) y con Raúl Martorena (administrativo). Raúl no pinta nada. Miguel está interesado en una;Cancelado;25/06/2025;;;15;Not Valid;Antonio;Others;Antonio Caro Lázaro;;Unknow;22/06/2022;22/06/2022;09/09/2022;07/01/2025;;;;ACL;;No;Yes;CRÉDITO Y CAUCIÓN;8b496e6c798c424e8edf75e292ef96;> 100 MM €;2000 - 8000;;BARCELONA;;;;25/06/2025;;;Qualified;0,0;0;0;0;0,0;3.500;;3856062087496340000;Antonio Caro Lázaro;Antonio Caro Lázaro;25/06/2025;;;Prime;"Cuentas a Cobrar Área de Caja.Han renovado con Informa hasta junio 2026.
Tratar de sacar visita a principios de 2026 con otro interlocutor (Dtor financiero, CM o DC)";;Active;8172376466360960000;851,0;;;;;;;;;22/01/2025;1;11;8031098;Mario Fernández Frade;-1;Cancelled;;;;;;;;;;;;FALSO;;Captación;;;"Cuentas a Cobrar Área de Caja.Han renovado con Informa hasta junio 2026.
Tratar de sacar visita a principios de 2026 con otro interlocutor (Dtor financiero, CM o DC)";FALSO;;;FALSO;ND;Active;;;Others;FALSO;FALSO;Other;;Paz Espin Cañabate;VERDADERO;VERDADERO;ESP;FALSO;-1;mffrade@atlax360.com;0;VERDADERO;C/Viriato 47, Edificio Numanci;VERDADERO;VERDADERO;;8031098;SAP Business One;;FALSO;;315,0;32,0;6,0;0,0;23/01/2023;17/12/2024;BARCELONA;08014;0;0;0;0;0;0;;;;;Gran Cuenta;;1;FALSO;;;;False;;;FALSO;;;;;;;;>=100M €;VERDADERO;;;;;FALSO;4,0;1,0;FALSO;;;;;;;;;;315;;FALSO;Mario Fernández Frade;Mario Fernández Frade;;;< 200;17/12/2024;Not Implemented;FALSO;;;EUR;4;Others;-8,70174e+18;CRÉDITO Y CAUCIÓN;27/01/2025;;;;;;;Antonio Caro Lázaro;;2,0;;30/12/2025;;;;;;27/01/2025;;;;;Activo;Activo;28/12/2025
ESP;ESP;FRUITS CMR;17/01/2025;3;FALSO;G1;€ 249.424.472;4.750;Microsoft;1;Alimentación, Bebidas y Tabaco;Francesc Forcada Oriol;Asociaciones;€ 0;€ 160;2;€ 0;€ 25.200;€ 25.200;NECESIDAD CONCRETA;8;;0,0;33,0;FRUITS CMR - 25/05/2017 16:39;Contract;Contrato;A58267683;ESP_Mercabarna;REUNIDO CON LA GERENTE, EL DF Y EL CONTABLE. LES PARECE INTERESANTE. ESTÁN CON CYC HASTA FEBRERO 2026. SOLICITAN OFERTA Y DICEN QUE HABLARÁN CON PERE;Contrato Firmado;19/02/2025;17/01/2025;100 %;41;Valid;Francesc;Others;;Francisco Salvador;Dir. Financiero;25/05/2017;;;09/01/2025;;;19/02/2025;FFO;17/01/2025;No;Yes;CYC;foriol@atlax360.com;> 100 MM €;2000 - 8000;;BARCELONA;Won;;20/01/2025;;;19/02/2025;Qualified;3000,0;0;0;1.750;0,0;;;-4333311987459090000;Francesc Forcada Oriol;Francesc Forcada Oriol;19/02/2025;;;Prime;;17/01/2025;Active;-4768879073511400000;;;;;;;;;;17/01/2025;1;11;58267683;María Rosa Pérez Sánchez;3499;Delivered;277 Mayorista de frutas y hortalizas;Alimentación, Bebidas y Tabaco;30/07/2025;1,0;2644,0;234720575,8;54684,93927;0,00165;0,000351;38,494027;francisco.salvador@cmrfruits.com;FALSO;FALSO;Captación;ADMISIÓN;;INTERESADOS EN YNDIKA Y SCF;FALSO;;10001868,0;VERDADERO;ND;Active;;;Others;FALSO;VERDADERO;Other;;Paz Espin Cañabate;VERDADERO;VERDADERO;ESP;FALSO;-1;mpsanchez@atlax360.com;0;VERDADERO;POLÍGON L’ESTRUCH CARRER 6, 1;VERDADERO;VERDADERO;;58267683;Axapta;Francesc Forcada Oriol;FALSO;33,0;2,0;36,0;10,0;0,0;28/06/2023;08/01/2025;PRAT DE LLOBREGAT (EL);08820;0;0;0;0;0;0;QUO-09523-P9X6J7;ORD-01923-S2S6T1;YND/001487;DYNAMIC AX 2012;Gran Cuenta;;1;VERDADERO;932626600;;246.744.989 €;False;;;FALSO;;Yesenia Trascastro Pulgar;FRANCISCO SALVADOR;QUIM MORER;ASAP;24/02/2025;450,0;>=100M €;VERDADERO;;;;;FALSO;1,0;1,0;FALSO;0,0;0,0;3000,0;0,0;0,0;0,0;0,0;;;320;33,0;FALSO;María Rosa Pérez Sánchez;María Rosa Pérez Sánchez;;Francesc Forcada Oriol;2000 - 5000;08/01/2025;Other Credit Insurance;FALSO;0,0;25200,0;EUR;4;Others;-3,34191e+18;CRÉDITO Y CAUCIÓN;09/01/2025;;;;;;;María Rosa Pérez Sánchez;;;;30/03/2026;;;;;;09/01/2025;;;;;Activo;Activo;30/03/2026
ESP;ESP;LOGITERS LOGISTICA;17/03/2025;12;FALSO;G2;€ 217.344.568;1.010;SAP;1;Transportes y Almacenamiento;Antonio Caro Lázaro;Partner;€ 0;€ 160;2;€ 0;€ 20.004;€ 20.004;;3;;14,0;247,0;ID LOGISTICS IBERIA SA - 16/03;Postponed;Propuesta;A08057895;ESP_Partner_MasterInformatica;17/03/25 Me reúno con Beatriz Azpiroz (Dtora tesorería), Álvaro Bernal (Controller) y Gema López ( Gestor de cobros y resp. clientes). Sería para la p;Aplazada;10/06/2041;31/03/2025;;264;Valid;Antonio;Others;;;Unknow;16/03/2023;16/03/2023;10/02/2025;14/03/2025;;;;ACL;31/03/2025;No;NO;;8b496e6c798c424e8edf75e292ef96;> 100 MM €;500 - 2000;22/04/2026;MADRID;Presentada;;31/03/2025;;;;Qualified;1000,0;1.000;1.000;10;0,0;;;-7118596392579690000;Antonio Caro Lázaro;Antonio Caro Lázaro;10/04/2025;;;Prime;Están migrando de ERP y hasta mayo / junio 2026 no cree que hayan finalizado.;31/03/2025;Active;1120122063883740000;32,0;;;;;;;;;31/03/2025;1;11;8057895;María Rosa Pérez Sánchez;-1;Postponed;;;;;;;;;;;;FALSO;FALSO;Captación;;;Están migrando de ERP y hasta mayo / junio 2026 no cree que hayan finalizado.;VERDADERO;;;VERDADERO;Clientes monitoriza;Active;;;Others;FALSO;FALSO;Other;;Lucia Muñoz Salas;VERDADERO;VERDADERO;ESP;FALSO;-1;mpsanchez@atlax360.com;0;VERDADERO;C/ Buenos Aires 10, P.I. Campo;VERDADERO;VERDADERO;;8057895;SAP ByDesign;;FALSO;261,0;247,0;9,0;3,0;0,0;10/02/2025;12/03/2025;Alcalá de Henares;28806;0;0;0;0;0;0;QUO-09835-X3J4B9;;;Trans 2000;Gran Cuenta;Owen Torres Wangensteen;1;FALSO;;;;False;;;FALSO;;;;;;;;>=100M €;VERDADERO;;;;;FALSO;1,0;1,0;FALSO;;;;;;;;;;261;;FALSO;María Rosa Pérez Sánchez;María Rosa Pérez Sánchez;MASTER INFORMÁTICA;Antonio Caro Lázaro;1000 - 2000;12/03/2025;Not Implemented;FALSO;0,0;20004,0;EUR;4;Others;-6,25388e+17;NO ASEGURADORA;17/03/2025;;;;;;;Antonio Caro Lázaro;;;;;;;;;;17/03/2025;;;;;Activo;Activo;
ESP;ESP;ACTEL;03/02/2025;6;FALSO;G1;€ 202.756.644;2.000;Sage;1;Alimentación, Bebidas y Tabaco;Antonio Caro Lázaro;Cold calling;€ 0;€ 80;1;;;€ 0;;5;;;;ACTEL - 22/06/2022 0:00;Cancelled;Lead;F25023938;ESP_TLC_PlanMK;No ofertada. Me reúno con Xavier Zubiaur (DF del grupo) y con Mónica Leal (Admtrativa). Son 3 empresas, 2 en SAGE X3 y una en SAP. Sin previsión de mi;Cancelado;03/02/2025;;;5;Not Valid;Antonio;Cold Calling;Antonio Caro Lázaro;;Unknow;22/06/2022;22/06/2022;04/08/2022;29/01/2025;;;;ACL;;No;Yes;Solunion;8b496e6c798c424e8edf75e292ef96;> 100 MM €;2000 - 8000;;LLEIDA;;;;03/02/2025;;;Qualified;1950,0;225;225;50;25,0;;;8589546618451530000;Antonio Caro Lázaro;Antonio Caro Lázaro;03/02/2025;;;Prime;No ofertada. Me reúno con Xavier Zubiaur (DF del grupo) y con Mónica Leal (Admtrativa). Son 3 empresas, 2 en SAGE X3 y una en SAP. Sin previsión de migraciones. Solo querían conocer el producto, pero están con otras prioridades y no ven necesidad. Sus clientes muchos de ellos son cooperatiuvistas por lo que son clientes y proveedores a la vez. No tienen apenas morosidad y la dirección les obliga a asegurar todas las ventas.;;Active;-5449600522141890000;909,0;;;;;;;;;03/02/2025;1;11;25023938;Mario Fernández Frade;-1;Cancelled;;;;;;;;;;;;FALSO;;Captación;;;No ofertada. Me reúno con Xavier Zubiaur (DF del grupo) y con Mónica Leal (Admtrativa). Son 3 empresas, 2 en SAGE X3 y una en SAP. Sin previsión de migraciones. Solo querían conocer el producto, pero están con otras prioridades y no ven necesidad. Sus clientes muchos de ellos son cooperatiuvistas por lo que son clientes y proveedores a la vez. No tienen apenas morosidad y la dirección les obliga a asegurar todas las ventas.;FALSO;;;FALSO;ND;Active;;;Others;FALSO;FALSO;Other;;Paz Espin Cañabate;VERDADERO;VERDADERO;ESP;FALSO;-1;mffrade@atlax360.com;0;VERDADERO;CARRETERA VAL DE ARAN, KM 3;VERDADERO;VERDADERO;;25023938;Sage X3;;FALSO;;303,0;10,0;1,0;0,0;25/01/2023;28/01/2025;LLEIDA;25196;0;0;0;0;0;0;;;;SAGE;Gran Cuenta;;1;FALSO;;;;False;;;FALSO;;;;;;;;>=100M €;VERDADERO;;;;;FALSO;1,0;1,0;FALSO;;;;;;;;;;303;;FALSO;Mario Fernández Frade;Mario Fernández Frade;;;2000 - 5000;28/01/2025;Not Implemented;FALSO;;;EUR;4;Others;-7,07843e+18;SOLUNION;03/02/2025;;;;;;;Antonio Caro Lázaro;;60,0;;30/12/2025;;;;;;03/02/2025;;;;;Activo;Activo;31/10/2025
ESP;ESP;CODORNIU;18/03/2025;12;VERDADERO;G2;€ 200.000.000;1.500;SAP;1;Alimentación, Bebidas y Tabaco;Antonio Caro Lázaro;Self calling;€ 0;€ 80;1;;;€ 0;;39;;;;Lead - 07/02/2025 0:00;Postponed;Lead;A08014953;ESP_TLC_2025_Prio1;;Aplazada;;;;39;Valid;Antonio;Others;;;Unknow;07/02/2025;07/02/2025;07/02/2025;07/02/2025;;;;ACL;;No;Yes;Crédito y Caución;8b496e6c798c424e8edf75e292ef96;> 100 MM €;500 - 2000;10/02/2026;BARCELONA;;;;;;;Qualified;1400,0;0;0;100;0,0;;;-8422936840819310000;Antonio Caro Lázaro;Antonio Caro Lázaro;24/03/2025;;;Prime;Me reúno con Victoria. Comenta que con One Rate, tras un periodo de conexión y adaptación algo complicado, desde Octubre ya les está dando sus frutos. Solo lo utilizan para recuperaciones y para calificar el riesgo cuando no tienen cobertura. Están contentos. Su broker actual es Marsh, han cambiado este año. Me comenta que retomemos el año que viene por estas fechas, porque necesitan cubrir Argentina y Rusia.;;Active;-934821695191511000;0,0;;;;;;;;;18/03/2025;1;11;8014953;Antonio Caro Lázaro;-1;Postponed;;;;;;;;;;;;FALSO;;Captación;;;Me reúno con Victoria. Comenta que con One Rate, tras un periodo de conexión y adaptación algo complicado, desde Octubre ya les está dando sus frutos. Solo lo utilizan para recuperaciones y para calificar el riesgo cuando no tienen cobertura. Están contentos. Su broker actual es Marsh, han cambiado este año. Me comenta que retomemos el año que viene por estas fechas, porque necesitan cubrir Argentina y Rusia.;FALSO;;;FALSO;ND;Active;;;Others;FALSO;FALSO;Other;;Paz Espin Cañabate;VERDADERO;VERDADERO;ESP;FALSO;-1;8b496e6c798c424e8edf75e292ef96;0;VERDADERO;AVENIDA JAUME CODORNIU 1;VERDADERO;VERDADERO;;8014953;SAP R3;;FALSO;;260,0;;;;;;SANT SADURNI D'ANOIA;08770;0;0;0;0;0;0;;;;;Gran Cuenta;;1;FALSO;;;;False;;;FALSO;;;;;;;;>=100M €;VERDADERO;;;;;FALSO;;;FALSO;;;;;;;;;;260;;FALSO;Antonio Caro Lázaro;;;;1000 - 2000;;Not Implemented;FALSO;;;EUR;4;Others;1,79467e+18;CRÉDITO Y CAUCIÓN;12/06/2024;;;;;;;Antonio Caro Lázaro;;60,0;;29/06/2024;;;;;;12/06/2024;;;;;Activo;Activo;30/04/2024
ESP;ESP;AGRUPACION HORTOFRUTICOLA LUCAS O. P. F. H.;06/03/2025;10;VERDADERO;G3;€ 171.743.673;0;Otros;1;Alimentación, Bebidas y Tabaco;Antonio Caro Lázaro;Cold calling;€ 0;€ 80;1;;;€ 0;;3;;;;AGRUPACION HORTOFRUTICOLA LUCA;Cancelled;Lead;B73819377;ESP_TLC_PlanMK;6/03 Me reúno con Daniel Quiles (CM) para ver si podemos seguir avanzando. Lo va atratar con su jefe y martes 11/03 me dice algo. 692 85 13 60. Ve com;Cancelado;11/03/2025;;;3;Not Valid;Antonio;Cold Calling;Antonio Caro Lázaro;;Unknow;22/06/2017;;28/02/2025;03/03/2025;;;;ACL;;No;Yes;ATRADIUS;8b496e6c798c424e8edf75e292ef96;> 100 MM €;500 - 2000;;MURCIA;;;;11/03/2025;;;Qualified;0,0;0;0;0;0,0;;;-3402948355921150000;Antonio Caro Lázaro;Antonio Caro Lázaro;11/03/2025;;;Prime;No permiten acceso a terceros de su información;;Active;-3848566047698190000;3,0;;;;;;;;;06/03/2025;1;11;73819377;Mario Fernández Frade;-1;Cancelled;;;;;;;;;;;;FALSO;;Captación;;;No permiten acceso a terceros de su información;FALSO;;;FALSO;ND;Active;;;Others;FALSO;FALSO;Other;;Paz Espin Cañabate;VERDADERO;VERDADERO;ESP;FALSO;-1;mffrade@atlax360.com;0;VERDADERO;CARRETERA SANTOMERA-ALQUERÍAS;VERDADERO;VERDADERO;;73819377;Otros;;FALSO;;272,0;2,0;0,0;0,0;03/03/2025;03/03/2025;EL RAAL;30139;0;0;0;0;0;0;;;;Cenn;Gran Cuenta;Owen Torres Wangensteen;1;FALSO;;;;False;;;FALSO;;;;;;;;>=100M €;VERDADERO;;;;;FALSO;1,0;1,0;FALSO;;;;;;;;;;272;;FALSO;Mario Fernández Frade;Mario Fernández Frade;;;< 200;03/03/2025;Not Implemented;FALSO;;;EUR;4;Others;8,5801e+18;ATRADIUS;07/03/2025;;;;;;;Antonio Caro Lázaro;EUR;60,0;1,0;30/12/2025;;;;;;07/03/2025;90.000 €;90.000 €;;;Activo;Activo;31/10/2025
ESP;ESP;NUZOA ANIMAL HEALTH;10/04/2025;15;FALSO;G1;€ 140.000.000;18.000;Microsoft;1;Actividades Financieras y Seguros;Antonio Caro Lázaro;Cold calling;€ 0;€ 160;2;€ 12.000;€ 27.996;€ 39.996;OTRAS MODIFICACIONES EN SU CAR;8;;18,0;158,0;Lead - 23/06/2023 0:00;Rejected;Propuesta;B01593896;ESP_Prospección TLC;10/04/25 Presento PRIME. Me reúno con Hugo Campillo (DF Corporativo) y le resulta muy interesante. Son 8 empresas, 2 de ellas portuguesas, con 17k cli;Perdida;03/10/2025;28/04/2025;;184;Valid;Antonio;Cold Calling;Antonio Caro Lázaro;;Unknow;23/06/2023;23/06/2023;07/02/2024;02/04/2025;;;;ACL;28/04/2025;No;NO;;8b496e6c798c424e8edf75e292ef96;> 100 MM €;> 8000;;VIZCAYA;Lost;;10/04/2025;;03/10/2025;;Qualified;17000,0;0;0;1.000;0,0;;;-2907816090328360000;Antonio Caro Lázaro;Antonio Caro Lázaro;03/10/2025;;;Prime;;28/04/2025;Active;-6983886033384890000;420,0;;;;;;;;;28/04/2025;1;11;1593896;Mario Fernández Frade;-1;Rejected;;;;;;;;;;;;FALSO;FALSO;Corporativa;;;No han autorizado la contratación de l aplataforma para 2026 porque están inmersos actualmente en otros proyectos, como cambio de ERP, con nuevo CRM comercial y la plataforma sería un cambio radical en su forma de gestión que requiere tiempo de adaptación y ahora no pueden dedicarselo. Comenta que volvemos a hablar para 2026 porque les interesa.;FALSO;;;VERDADERO;ND;Active;;;Others;FALSO;FALSO;Other;;Rocio Benedicto Martinez;VERDADERO;VERDADERO;ESP;FALSO;-1;mffrade@atlax360.com;0;VERDADERO;Neurketa, 16;VERDADERO;VERDADERO;;1593896;Navision;;FALSO;176,0;219,0;4,0;0,0;0,0;10/03/2025;02/04/2025;Mungia;48100;0;0;0;0;0;0;QUO-09908-H3Q7D7;;;;Gran Cuenta;Carmen Cueto Garcia;1;FALSO;;;;False;;;FALSO;;;;;;;;>=100M €;VERDADERO;;;;;FALSO;3,0;1,0;FALSO;;;;;;;;;;237;;FALSO;Mario Fernández Frade;Mario Fernández Frade;;Antonio Caro Lázaro;> 8000;02/04/2025;Not Implemented;FALSO;12000,0;27996,0;EUR;4;Others;2,26507e+18;NO ASEGURADORA;23/06/2025;;;;;;;Antonio Caro Lázaro;;;;;;;;;;23/06/2025;;;;;Activo;Activo;
ESP;ESP;ESCORXADOR COMARCAL DEL MOIANES;11/04/2025;15;FALSO;G3;€ 133.076.114;840;Otros;1;Alimentación, Bebidas y Tabaco;Francesc Forcada Oriol;Call Center;€ 0;€ 160;2;€ 0;€ 29.328;€ 29.328;ACEPTA ACTIVACIÓN DE LA OFERTA;1;;-2,0;238,0;ESCORXADOR COMARCAL DEL MOIANE;Proposal;Propuesta;A60014651;ESP_TLC_2025_Prio1;GENIS, CM. LO VE INTERESANTE, SON UN GRUPO DE EMPRESAS. DICE QUE LE ENVIE LA OFERTA Y HABLARÁ CON GERENCIA;Propuesta Presentada;30/07/2025;09/04/2025;30 %;237;Valid;Francesc;Others;;ROSALÍA MEMBRIVE SERRA;CFO;30/11/2022;30/11/2022;21/12/2022;10/04/2025;;;;FFO;09/04/2025;No;Yes;CRÉDITO Y CAUCIÓN;foriol@atlax360.com;> 100 MM €;500 - 2000;;BARCELONA;Presentada;;05/05/2025;;;;Qualified;700,0;0;0;140;0,0;;;-6460227345115640000;Francesc Forcada Oriol;Francesc Forcada Oriol;05/05/2025;;;Prime;;09/04/2025;Active;-4469946254538890000;841,0;;;;;;;;;11/04/2025;1;11;60014651;Paz Espin Cañabate;-1;Proposal;;;;;;;;;;;rosalia@ecm.cat;FALSO;FALSO;Captación;;;;FALSO;;;VERDADERO;ND;Active;;;Others;FALSO;FALSO;Other;;Paz Espin Cañabate;VERDADERO;VERDADERO;ESP;FALSO;-1;pespin@atlax360.com;0;VERDADERO;Avinguda del Prat, s/n;VERDADERO;VERDADERO;;60014651;Otros;;FALSO;236,0;236,0;4,0;2,0;0,0;19/01/2023;30/01/2023;MOIÀ;08180;0;0;0;0;0;0;QUO-09964-J5X1Q0;;;propio;Gran Cuenta;Irene Pereira;1;FALSO;938208295;;;False;;;FALSO;;;;;;;;>=100M €;VERDADERO;;;;;FALSO;1,0;1,0;FALSO;;;;;;;;;;236;;FALSO;Paz Espin Cañabate;Isabel Santiago Rascon;;Francesc Forcada Oriol;500 - 1000;30/01/2023;Not Implemented;FALSO;0,0;29328,0;EUR;4;Others;-8,02297e+17;CESCE;10/04/2025;;;;;;;Paz Espin Cañabate;;;;30/04/2025;;;;;;10/04/2025;;;;;Activo;Activo;30/04/2025
ESP;ESP;GRUPO PUMA ESPAÑA;31/03/2025;14;VERDADERO;G3;€ 121.944.863;0;Microsoft;1;Construcción;Antonio Caro Lázaro;Cold calling;€ 0;€ 80;1;;;€ 0;;10;;;;Lead - 10/04/2024 0:00;Postponed;Lead;B14528921;ESP_TLC_2025_Prio1;31/03/25 Me reúno con Jorge Ardiles (dtor de riesgos). Le gusta, pero a final de año migran a 365BC y además tienen póliza con Cesce hasta 31/12/2026.;Aplazada;;;;10;Valid;Antonio;Cold Calling;Antonio Caro Lázaro;;Unknow;10/04/2024;10/04/2024;14/02/2025;21/03/2025;;;;ACL;;No;Yes;CESCE;8b496e6c798c424e8edf75e292ef96;> 100 MM €;500 - 2000;18/03/2026;CORDOBA;;;;;;;Qualified;0,0;0;0;0;0,0;;;3035212242402940000;Antonio Caro Lázaro;Antonio Caro Lázaro;31/03/2025;;;Prime;31/03/25 Me reúno con Jorge Ardiles (dtor de riesgos). Le gusta, pero a final de año migran a 365BC y además tienen póliza con Cesce hasta 31/12/2026. Por este motivo, me pide retomar en marzo del año que viene. Sus riesgos son de iportes bajos. Tienen unos 3.000 clientes, de los que 600 son Export( unos 400 en PT y el resto Italia Francia, Colombia, Argelia y Marruecos). Riesgo medio 10-12k€;;Active;-6459437588501490000;35,0;;;;;;;;;31/03/2025;1;11;14528921;Mario Fernández Frade;-1;Postponed;;;;;;;;;;;;FALSO;;Corporativa;;;31/03/25 Me reúno con Jorge Ardiles (dtor de riesgos). Le gusta, pero a final de año migran a 365BC y además tienen póliza con Cesce hasta 31/12/2026. Por este motivo, me pide retomar en marzo del año que viene. Sus riesgos son de iportes bajos. Tienen unos 3.000 clientes, de los que 600 son Export( unos 400 en PT y el resto Italia Francia, Colombia, Argelia y Marruecos). Riesgo medio 10-12k€;FALSO;;;FALSO;ND;Active;;;Others;FALSO;FALSO;Other;;Paz Espin Cañabate;VERDADERO;VERDADERO;ESP;FALSO;-1;mffrade@atlax360.com;0;VERDADERO;AVENIDA AGRUPACION CORDOBA 17;VERDADERO;VERDADERO;;14528921;D365BC;;FALSO;;247,0;4,0;0,0;0,0;14/02/2025;21/03/2025;CORDOBA;14014;0;0;0;0;0;0;;;;Actualmente Dynamics AX.Migran;Gran Cuenta;;1;FALSO;;;;False;;;FALSO;;;;;;;;>=100M €;VERDADERO;;;;;FALSO;1,0;1,0;FALSO;;;;;;;;;;247;;FALSO;Mario Fernández Frade;Mario Fernández Frade;;;< 200;21/03/2025;Not Implemented;FALSO;;;EUR;4;Others;-6,833e+18;CESCE;31/03/2025;;95,0;;;;Firmaron póliza bienal el 31/12/2024, hasta 31/12/2026;Antonio Caro Lázaro;;60,0;;30/12/2026;;;;;;31/03/2025;;;;;Activo;Activo;31/10/2026
